post_id,comment_id,subreddit,text_type,epoch_time,text,tickers
mgbnlp,gstda68,stocks,comment,1617121470,"You’re all missing the point. These are all companies that will benefit from space exploration. Take Netflix for example. Already most people you know will either have their own account or share someone else’s. So how can they continue to expand their user base? By exploring space and discovering alien civilisations, that’s how. They can then sell their monthly subscriptions to these aliens.",['NFLX']
mgtusp,,stocks,post,1617150151,"Are premium research services worth it?I'm gonna be perfectly honest, over the last year I've made some decent gains but I wouldn't exactly say it was because of skill or due diligence there's just been crazy upward movement in almost all stocks (discounting the last few weeks of course). Now that the pickings aren't as easy and the market is getting back to a place of being flat/volatile I want to step my game up a bit. I've already purchased some books and found some youtubers I like but my question is this; Are professional research services like Motley fool stock adviser, Tip ranks premium, Zacks premium etc... worth it? Do they actually provide meaningful investing insights that would be hard to get on your own or are they just a money grabbing trap for new folks. If so which ones do you guys feel are the best. 

TLDR- Are premium research services like Zacks, motley fool or tip ranks worth the money or are they trash.",
mgtusp,gsvx46i,stocks,comment,1617169485,"I subscribed to Motley Fool's SA and RB. I'm not paid by them and have nothing to do with them, except that I'm a relatively new customer.Cons:- when you subscribe, you have to explain to everyone who knows them that you are NOT paying for their crappy junk free articles; in my eyes, they are hurting their business so much by producing this free garbage- many (but not all) recommended stocks seem like obvious picks (such as, buy Amazon)- they start selling you on MORE services for even CRAZIER returns, and they use outdated, annoying, pathetic marketing. (Motley people, if you are reading this, you really REALLY need a new marketing team. The crap you put out now is embarrassing. ""ONLY TODAY you can click here for our 100009990000% returning stock advice for only 1800 dollars but discounted to 1300..."" Cringe-worthy.)

Pros:- DDs on premium (paid) services are all decent; there are pros, cons for a stock; everything you need to know in a short readable article- I have never heard about some of the recommended stocks that seem to be good stocks (I'm a newish subscriber, so I don't know what happens in 3-5 years, which they recommend for holding)- It makes you buy the stock that you KNEW was a good stock, but for some reason didn't buy before because it is too obvious - for example, they tell you: ""we think that these 5 stocks are a good buying opportunity now"" - and then I finally DO buy a stock like Amazon or Paypal (which I believed to be good stocks anyway). This is more psychological/behavioral, but for some stocks I need the nudge to actually buy them.

\- I have fun waiting for new stock recommendations every week, and I make it a goal to save for and buy one of the recommended stock each time, so I invest every week.  


PS. Edit to add: I did read MANY books and took university courses. However, I use this for more concrete suggestions than what I have learnt through theories of investing. I also am too lazy to go through hundreds of stocks and do the analysis. I have a job already.","['PYPL', 'AMZN']"
mgtusp,gsvb54v,stocks,comment,1617155273,"Check their track record.

I don't recommend using any source of research at all but what you can do yourself, because everybody is full of it. Nobody is your friend.

But a premium service with a good history, you can just compare their results to your own and know what you're getting.

A youtube channel, you don't know what you're getting, and they can delete videos that were duds. They're not going to have the time in the market that the premium services have, either. You're better off rolling dice than trading on free stock picks, and this sort of ""research"" isn't really research; it is a just a pick that is being marketed to you.

But if you don't have time to do the research, maybe just S&P 500 + one small cap ETF + one emerging markets ETF is a better strategy? Weighted to mostly S&P. 👼",['SPGI']
mgtusp,gsv285m,stocks,comment,1617150419,I’m not going to be of any help but am curious about the books you’ve picked up.  If you’ve read them yet do you have any that you recommend?,
mgtusp,gsv3m41,stocks,comment,1617151172,Can be if you don’t have time or willpower to research on your own.,
mgtusp,gsv72ld,stocks,comment,1617153067,You may rather want to sub to a live news scanner. I been using one for awhile and it’s great for daytrading or general investing,
mgnz48,,stocks,post,1617132716,"How to tell if you ""know"" a company well enough to invest in it?A recommendation I find very often is that you should ""know what you own"" or ""invest in your circle of competence."" *How much should you know about a company to be at the point where you are really ""investing"" and not merely speculating?* It is not really possible to know the ins and outs of all the types of businesses out there, so I don't know how people usually go about due diligence without limiting themselves to a few select industries they may be able to intuitively understand.",
mgnz48,gsu2clp,stocks,comment,1617132716,"Welcome to r/stocks!

For stock recommendations please see our portfolio sticky, sort by hot, it's the first sticky, or see [past portfolio stickies here.](https://www.reddit.com/r/stocks/search?q=author%3Aautomoderator+%22Rate+My+Portfolio%22+-+r%2FStocks+Quarterly+Thread&restrict_sr=on&include_over_18=on&sort=new&t=all)

For beginner advice, brokerage info, book recommendations, even advanced topics and more, please read our [Wiki here.](https://www.reddit.com/r/stocks/wiki/index)

If you're wondering **why a stock moved** a certain way, check out [Finviz](https://finviz.com/quote.ashx?t=spy) which aggregates the most news for almost every stock, but also see [Reuters](https://www.reuters.com/), and even [Yahoo Finance](https://finance.yahoo.com/).

Also include *some* [due diligence](https://www.investopedia.com/terms/d/duediligence.asp) to this post or it may be removed if it's low effort.

*I am a bot, and this action was performed automatically. Please [contact the moderators of this subreddit](/message/compose/?to=/r/stocks) if you have any questions or concerns.*",
mgnz48,gsu35n7,stocks,comment,1617133083,"Yes, you cannot possibly know the ins and outs like the employees or founders can. However you have an advantage that the founders don't. You can diversify your holdings to reduce risk but still invest in great companies.

If a company is in your circle of competence then you should be comfortable reading their financial reports and understand it fairly quickly. If you can't understand the business in around 30 seconds I would just move on to another company.

I use [docoh](https://docoh.com) for all of this usually including ratio's.

For example, I do DD on a company overall for around 5 hours, first by reading the reports, looking at the financials such as PEG ratio, checking news and then doing intrinsic valuations such as DCF's. I find Aswath Damodaran's DCF's the best, this one: [https://www.youtube.com/watch?v=F9GfXJ-IrSA](https://www.youtube.com/watch?v=F9GfXJ-IrSA)

And also this tool which I use to automate part of the DCF for companies: [tracktak](https://tracktak.com/)  


You can also read this entire fundamentals guide if you need more help or check out the r/stocks wiki: [https://www.reddit.com/r/UndervaluedStonks/comments/kheec2/the\_ultimate\_fundamentals\_guide\_on\_what\_you\_need/](https://www.reddit.com/r/UndervaluedStonks/comments/kheec2/the_ultimate_fundamentals_guide_on_what_you_need/)",['PEG']
mgnz48,gsu4pcl,stocks,comment,1617133787,When you find out all the bad news and you still think the positive side is stronger.,
mgnz48,gsu8ixw,stocks,comment,1617135532,"As other have said, you will never truly know the company. That's why ETFs are always preferred choice for retail investors. And even if you know a lot, sometimes things just happen. Like I invested in this private equity firm and it turned out that founder was sending millions to Epstein. Stock price took a plunge after the news came out. But how are you supposed to know that kind of thing. In any case, the way I see it for myself, there are 3 levels of knowing. 1) I know very little and just hope equity price will appreciate because of momentum or whatever, i.e. gambling 2) I know something but it's relatively safe company so I don't worry holding those equities because chances of them exploding are low, e.g. ADM, RIO, BHP 3) I know not only financials but also the company's products and done some extra research on top of that. Say maybe I work as SysOps so I know industry and I know what products are good and what products are bad so I invested in certain IT equities.

Overall, however, I must be humble and must accept that I'm not smarter thant the market and I'm unlikely to have some smart insights that are not already priced in. I hope for average returns and anything extra is a bonus.",['ADM']
mh1zc3,,investing,post,1617181271,"Daily General Discussion and spitballin thread - March 31, 2021Have a general question?  Want to offer some commentary on markets?  Maybe you would just like to throw out a neat fact that doesn't warrant a self post?  Feel free to post here! 

This thread is for: 

* General questions
* Your personal commentary on markets
* Opinion gathering on a given stock
* Non advice beginner questions

Keep in mind that this subreddit, and this thread, is not an appropriate venue for questions that should be directed towards your broker's customer support or google.  

If you would like to ask a question about your personal situation or if you are asking for advice please keep these posts in the daily advice thread as that thread is more well suited for those questions.

Any posts that should be comments in this thread will likely be removed.",
mh1zc3,gswaz7w,investing,comment,1617181272,"**Hi, welcome to /r/investing. Please note that as a topic focused subreddit we have higher posting standards than much of Reddit:**

**1)** Please direct all **advice requests and beginner questions to the stickied daily threads.** This includes beginner questions and portfolio help.

**2) Important: We have strict political posting guidelines** (described [here](https://www.reddit.com/r/investing/comments/cyee69/formal_posting_guidelines_for_political_topics/) and [here](https://www.reddit.com/r/investing/comments/escewo/temporary_rule_change_what_happens_to_stocks_if/)). Violations will result in a likely 60 day ban upon **first instance.**

**3)** This is an open forum but we expect you to conduct yourself like an adult. Disagree, argue, criticize, but **no personal attacks.**


*I am a bot, and this action was performed automatically. Please [contact the moderators of this subreddit](/message/compose/?to=/r/investing) if you have any questions or concerns.*",
mh1zc3,gswgjxp,investing,comment,1617186949,"Good morning contrarians!

Futures are flat as of 0600. Dow, S&P, Russell 2000 all hovering around their close from yesterday. Tech stocks are trying to get off the ground, with the Nasdaq up 0.3%. Bond yields are steady as well.

There just isn’t all that much to move the market. (By the way, notice how quickly we’ve already moved on from Archegos?) Earnings season doesn’t kick off for another couple of weeks and there just don’t seem to be any catalysts until then.

We do have the ADP jobs numbers for March, scheduled for release before the open. 550,000 new jobs are expected. This usually doesn’t move things very much unless there’s major deviation from what’s anticipated.

That leaves us with today’s infrastructure announcement by the Biden administration. Lots of drama around this already, as can be expected from an incoming administration’s first major piece of legislation (not to mentioned the poisoned political climate we find ourselves in).

But details of these plans have (been) leaked out already and frankly they don’t look particularly draconian where tax policy is concerned: Corporate taxes will be raised from 21% to 28%. That’s still well below the 35% level that existed prior to Trump’s tax cuts.

That’s it. Nothing about income taxes on individuals, wealthy or otherwise. Some talk about discouraging tax havens for corporations that I’m sure will be well heeded but ultimately go nowhere.

So unless the Biden administration is hiding its true intentions with this infrastructure bill, there doesn’t seem to be any reason for concern. There could of course be further policy announcements forthcoming. Maybe that’s what the market is worried about. But even then, the Democrats’ majority in the Senate is razor thin.

In the end this whole infrastructure bill may just end up being more PR than anything else. Certainly wouldn’t be the first time.","['NDAQ', 'SPGI', 'DOW', 'ADP']"
mh1zc3,gswbj6g,investing,comment,1617181854,"I’ve been thinking (always dangerous!) about where the market is headed (even more dangerous!) and can’t shake the feeling that we are riding a Tiger that is getting hungry; would love to hear a rebuttal to the below lukewarm bear case. Let me preface this by saying this is not financial advice and my ‘bear case’ does not mean a 40% crash. That said:

1. We’re unquestionably in an exuberant state. Lots of liquidity pouring into markets and very, very few bears outside of the folks who see a cloudy day as a harbinger of doom. Bears have largely capitulated, which makes me nervous.

2. A substantial % of this liquidity comes from new-ish traders (mostly not buy-and-hold types) who are case studies for Dunning-Kruger. I’m not quite sure if this is net-negative or not, but at the very least it is a powder keg. 

3. There is a literal sub for GME. This one feels self-explanatory. 

4. Forward-looking rate hikes/inflation/yield volatility seems to be the only structural thing spooking US equities. This could be viewed as bullish, it could be a blowout year for GDP growth. But the underlying reality is that central banks have pumped just about every asset class there is for years and have accelerated that pace post-COVID. \*If\* real inflation jumps, the FED has backed itself into a corner RE: early rate hikes, no? 

5. Tech is objectively overbought – even proven companies like AMZN are carrying forward EPS of 50x +. Again, this could be seen as bullish, but that seems out of whack for a company that did something like 16% growth last year. 

6. We’re seeing an explosion of nonfungible goods being sold for outrageous prices. An NFT is a JPEG that is valuable because people say it’s valuable. A fiat currency with no stable value, utility, or state support. This emperor has no clothes and folks are pretending he’s wearing bespoke Kiton. 

7. The market seems to be a bit exhausted by the nonstop stimulus and spending, and I see nothing but more of that on the 21-22 horizon. Some of it will be funded via tax increases. Tons of money into the market this year, but a choppy grind sideways since end of January \*DOW notwithstanding, bless its heart for keeping me in decent shape\*

What do y’all think?","['AMZN', 'DOW']"
mh1yrw,,investing,post,1617181215,"Daily Advice Thread - All basic help or advice questions must be posted here.If your question is ""I have $10,000, what do I do?"" or other ""advice for my personal situation"" questions, you should include relevant information, such as the following:

* How old are you? What country do you live in?  
* Are you employed/making income? How much?  
* What are your objectives with this money? (Buy a house? Retirement savings?)  
* What is your time horizon? Do you need this money next month? Next 20yrs?  
* What is your risk tolerance? (Do you mind risking it at blackjack or do you need to know its 100% safe?)  
* What are you current holdings? (Do you already have exposure to specific funds and sectors? Any other assets?)  
* Any big debts (include interest rate) or expenses?  
* And any other relevant financial information will be useful to give you a proper answer.  

Please consider consulting our FAQ first - https://www.reddit.com/r/investing/wiki/faq
And our [side bar](https://www.reddit.com/r/investing/about/sidebar) also has useful resources.  

Be aware that these answers are just opinions of Redditors and should be used as a starting point for your research. You should strongly consider seeing a registered financial rep before making any financial decisions!",
mh1yrw,gswaxcn,investing,comment,1617181216,"**Hi, welcome to /r/investing. Please note that as a topic focused subreddit we have higher posting standards than much of Reddit:**

**1)** Please direct all **advice requests and beginner questions to the stickied daily threads.** This includes beginner questions and portfolio help.

**2) Important: We have strict political posting guidelines** (described [here](https://www.reddit.com/r/investing/comments/cyee69/formal_posting_guidelines_for_political_topics/) and [here](https://www.reddit.com/r/investing/comments/escewo/temporary_rule_change_what_happens_to_stocks_if/)). Violations will result in a likely 60 day ban upon **first instance.**

**3)** This is an open forum but we expect you to conduct yourself like an adult. Disagree, argue, criticize, but **no personal attacks.**


*I am a bot, and this action was performed automatically. Please [contact the moderators of this subreddit](/message/compose/?to=/r/investing) if you have any questions or concerns.*",
mh1yrw,gswy6h3,investing,comment,1617198927,"I'm 21 and looking for long-term growth. I'm currently 50% in VGRO and 50% in two banks that have shown good returns/dividends because of advice from my dad. After looking through here, though, and comparing the growth of VGRO with other ETFs, I'm looking to make a switch.

My plan is to change VGRO to be 40% VTI, 40% QQQ, and 20% VXUS. I might also transfer a portion of my bank investments into these ETFs and maybe make my portfolio 75% ETFs and 25% banks. Do you guys think this is a good portfolio for passive long-term growth? What are your opinions on the ETFs I've chosen? Any advice would be appreciated!

Edit: I'm a Canadian investor. How should this factor into my decisions? I'm thinking I should choose VUN instead of VTI.",
mh1yrw,gszgs48,investing,comment,1617242603,Can I get some updoots so I can join the paper trade contest. Long time lurker.,
mh1yrw,gswsciu,investing,comment,1617195717,"I invested 20k into a S&P500 ETF at kinda good time (coincidence) as a long term (5-10 years) investment.

The etf is up 20% for now. 
That's higher than the usual return you get on such an etf.

What's best practice in such a case? 

1.) Realize the gains and reinvest 

2.) Realize the whole fund and wait for the (inevitable?!) correction to re-invest at a lower point

3.) Just leave it sit there and ignore it. Most likely to loose out on the unusual jump, but more likely to catch any further jumps.

I know that time in the market beats timing the market, but can't imagine that one should let such an opportunity slip (especially as it is a very young investment). 

Thanks in advance!",['SPGI']
mhj59m,,investing,post,1617235429,"Microsoft wins U.S. Army contract for augmented-reality headsets, worth up to $21.9 billion over 10 years[Microsoft wins U.S. Army contract for augmented-reality headsets, worth up to $21.9 billion over 10 years](https://www.cnbc.com/2021/03/31/microsoft-wins-contract-to-make-modified-hololens-for-us-army.html)

News broke maybe 4 hours ago. MSFT shot up 1% on that news, up more than 2% on the day.

Some highlights from the CNBC article:

>""Microsoft will deliver to the U.S. Army over 120,000 devices based on its HoloLens augmented-reality headset.""  
""The standard-issue HoloLens, which costs $3,500, enables people to see holograms overlaid over their actual environments and interact using hand and voice gestures.""  
""A group of employees called on Microsoft to cancel the HoloLens contract. “We did not sign up to develop weapons, and we demand a say in how our work is used,” the employees wrote in an open letter regarding the HoloLens contract.""

Thoughts on this news? What do you guys think about some employees opposing the decision? All I know is Microsoft is a monster of a company. Just another reason to continue holding I guess",['MSFT']
mhj59m,gsz35a7,investing,comment,1617235430,"**Hi, welcome to /r/investing. Please note that as a topic focused subreddit we have higher posting standards than much of Reddit:**

**1)** Please direct all **advice requests and beginner questions to the stickied daily threads.** This includes beginner questions and portfolio help.

**2) Important: We have strict political posting guidelines** (described [here](https://www.reddit.com/r/investing/comments/cyee69/formal_posting_guidelines_for_political_topics/) and [here](https://www.reddit.com/r/investing/comments/escewo/temporary_rule_change_what_happens_to_stocks_if/)). Violations will result in a likely 60 day ban upon **first instance.**

**3)** This is an open forum but we expect you to conduct yourself like an adult. Disagree, argue, criticize, but **no personal attacks.**


*I am a bot, and this action was performed automatically. Please [contact the moderators of this subreddit](/message/compose/?to=/r/investing) if you have any questions or concerns.*",
mhj59m,gszclpd,investing,comment,1617240411,"MVIS, who makes the LiDAR for the headsets, jumped 50% today on the news.",
mhj59m,gszp599,investing,comment,1617247359,"Microvision, the company that makes the Mems display engine in IVAS had its stock jump +50%",
mh6l6f,,investing,post,1617198775,"Goldman Sachs is close to offering bitcoin and other digital assets to its wealth management clientsGoldman Sachs is close to offering its first investment vehicles for bitcoin and other digital assets to clients of its private wealth management group, CNBC has learned exclusively.

The bank aims to begin offering investments in the emerging asset class in the second quarter, according to Mary Rich, who was recently named global head of digital assets for Goldman’s private wealth management division.

″We are working closely with teams across the firm to explore ways to offer thoughtful and appropriate access to the ecosystem for private wealth clients, and that is something we expect to offer in the near term,” Rich said in an interview this week.

Goldman is looking at ultimately offering a “full spectrum” of investments in bitcoin and digital assets, “whether that’s through the **physical bitcoin, derivatives or traditional investment vehicles**,” she said.

The move means that soon, clients of two of the world’s preeminent investment banks – Goldman and Morgan Stanley – will have access to a nascent asset class that has intrigued billionaires and digital currency believers alike. Earlier this month, Morgan Stanley told its financial advisors that **they could place clients into bitcoin funds starting in April**, CNBC was first to report.

It is the latest sign of the staying power of blockchain-related assets including bitcoin, a new kind of money that emerged out of the wreckage of the 2008 financial crisis and whose exact origins are still unknown. Until now, big U.S. banks have mostly shunned bitcoin, deeming it too speculative and volatile for clients.

But the industry capitulated after the latest boom in bitcoin’s price. The surge has drawn in institutional investors, corporations and fintech players, and the infrastructure to hold digital assets is continuing to mature. In the end, it was client demand that won out, according to Rich.

“There’s a contingent of clients who are looking to this asset as a hedge against inflation, and the macro backdrop over the past year has certainly played into that,” Rich said. “There are also a large contingent of clients who feel like we’re sitting at the dawn of a new Internet in some ways and are looking for ways to participate in this space.”

Goldman’s private wealth management business mostly targets individuals, families and endowments **with at least $25 million to invest**.

The bank may offer bitcoin investment funds, similar to those that Morgan Stanley will have, as well as other ways to invest that are “more akin to the underlying asset class which trades 24-7 globally,” Rich said. Some cryptofunds, such as the Galaxy Bitcoin Fund, can only be sold or bought once per quarter, she said.

“We’re still in the very nascent stages of this ecosystem; no one knows exactly how it will evolve or what shape it will be,” Rich said. “But I think it’s fairly safe to expect it will be part of our future.”


https://www.cnbc.com/2021/03/31/bitcoin-goldman-is-close-to-offering-bitcoin-to-its-richest-clients.html",['MS']
