post_id,comment_id,subreddit,text_type,epoch_time,text,tickers
mh28u8,,stocks,post,1617182413,"r/Stocks Daily Thread on Meme Stocks Wednesday - Mar 31, 2021The familiar [""Rate My Portfolio"" sticky can be found here.](https://www.reddit.com/r/stocks/search?q=author%3Aautomoderator+title%3Arate+my+portfolio&restrict_sr=on&sort=new&t=all)

-----

Welcome traders who just can't help them selves discuss the same exact stock that's been discussed 100s of times a day.  I get it, you want to talk about what's popular, what's hot, and that 1.. single.. stock you like.. well here you go!  Some helpful links just for you:
  
* [Previous meme stock threads](https://www.reddit.com/r/stocks/search?q=author%3Aautomoderator+title%3A%28common+OR+meme%29&restrict_sr=on&include_over_18=on&sort=new&t=all)  
* [Previous discussions on overlooked (and possibly undervalued) stocks](https://www.reddit.com/r/stocks/search?q=author%3Aautomoderator+title%3Aoverlooked&restrict_sr=on&include_over_18=on&sort=new&t=all)  
* [General discussions](https://www.reddit.com/r/stocks/search?q=author%3Aautomoderator+title%3Adiscussion&restrict_sr=on&include_over_18=on&sort=new&t=all)  
* [The **original GME megathread**](https://www.reddit.com/r/stocks/comments/layb68/rstocks_gme_megathread/) with a ton of useful information
* [Use Finviz for aggregated news on your favorite stock](https://finviz.com/quote.ashx?t=gme)  

An important message from our mod u/TCGYT [regarding meme stocks.](https://www.reddit.com/r/stocks/wiki/meme-stocks-warning)

Lastly if you need professional help:  
* Problem Gambling:  Call/Text: 1-800-522-4700 or [chat online now.](https://WWW.NCPGAMBLING.ORG/CHAT)  
* Crisis Hotline (24/7): 1-800-273-TALK (8255) (Veterans, press 1) or Text “HOME” to 741-741",
mh28u8,gswqvmh,stocks,comment,1617194824,"[https://www.reddit.com/r/GME/comments/mgucv2/the\_everything\_short/](https://www.reddit.com/r/GME/comments/mgucv2/the_everything_short/)

Anyone wants to poke holes in this and say this is wrong?

Also updated reverse repo treasury link here.[https://apps.newyorkfed.org/markets/autorates/tomo-results-display?SHOWMORE=TRUE&startDate=01/01/2000&enddate=01/01/2000](https://apps.newyorkfed.org/markets/autorates/tomo-results-display?SHOWMORE=TRUE&startDate=01/01/2000&enddate=01/01/2000)

  
Edit: To save you the time, it says 100B, up from 40B not long ago",
mh28u8,gsx8dgo,stocks,comment,1617203850,Anyone know how DISCB is up 94% today?  But DISCA and DISCK are normal?  Should I get some A or K?!!,"['DISCA', 'DISCK']"
mh28u8,gswlgsf,stocks,comment,1617191124,I’ve got some 12.50 BB CC for sale if your interested get em now before they are all gone lol,
mh28u8,gswdnjn,stocks,comment,1617184077,Thoughts on Blackberrys earnings?,
mh2dlx,,stocks,post,1617183011,"r/Stocks Daily Discussion Wednesday - Mar 31, 2021These daily discussions run from Monday to Friday including during our themed posts.

Some helpful links:

* [Finviz](https://finviz.com/quote.ashx?t=amd) for charts, fundamentals, and aggregated news on individual stocks
* [Bloomberg market news](https://www.bloomberg.com/markets)
  * StreetInsider news:
  * [Market Check](https://www.streetinsider.com/Market+Check) - Possibly why the market is doing what it's doing including sudden spikes/dips
  * [Reuters aggregated](https://www.streetinsider.com/Reuters) - Global news

If you have a basic question, for example ""what is EPS,"" then google ""investopedia EPS"" and click the investopedia article on it; do this for everything until you have a more in depth question or just want to share what you learned.

Please discuss your portfolios in the [Rate My Portfolio sticky.](https://www.reddit.com/r/stocks/search?sort=new&q=Rate+My+Portfolio+-+r%2FStocks+Quarterly+Thread&t=all&restrict_sr=on).

See our past [daily discussions here.](https://www.reddit.com/r/stocks/search?q=author%3Aautomoderator+%22r%2Fstocks+daily+discussion%22&restrict_sr=on&sort=new&t=all)  Also links for:  [Technicals](https://www.reddit.com/r/stocks/search?q=author%3Aautomoderator+title%3Atechnicals&restrict_sr=on&include_over_18=on&sort=new&t=all) Tuesday, [Options Trading](https://www.reddit.com/r/stocks/search?q=author%3Aautomoderator+title%3Aoptions&restrict_sr=on&include_over_18=on&sort=new&t=all) Thursday, and [Fundamentals](https://www.reddit.com/r/stocks/search?q=author%3Aautomoderator+title%3Afundamentals&restrict_sr=on&include_over_18=on&sort=new&t=all) Friday.","['AMD', 'GOOGL']"
mh2dlx,gsweqcp,stocks,comment,1617185177,"Everything green for me in premarket. I'm gonna pretend the stock market closes in an hour, good day for me.",
mh2dlx,gswhfyp,stocks,comment,1617187768,"My portfolio is completely green, I don't trust this shit for a minute. I fully expect it to be blood red EOD.",
mh2dlx,gswxbse,stocks,comment,1617198482,So is this the one green day I'm allowed per week?,
mh2dlx,gsyboy0,stocks,comment,1617221673,Name something more frustrating than seeing a stock on your watchlist being up 18%...😩,
mh2dlx,gswf3um,stocks,comment,1617185546,Yesterday was green for me so I already know it’s gonna be red today,
mhdrqg,,stocks,post,1617219120,"Microsoft wins U.S. Army contract for augmented-reality headsets, worth up to $21.9 billion over 10 years[Microsoft wins U.S. Army contract for augmented-reality headsets, worth up to $21.9 billion over 10 years](https://www.cnbc.com/2021/03/31/microsoft-wins-contract-to-make-modified-hololens-for-us-army.html)

News broke maybe 30 mins ago. MSFT shot up 1% on that news, up more than 2% on the day.

Some highlights from the CNBC article:

>""Microsoft will deliver to the U.S. Army over 120,000 devices based on its HoloLens augmented-reality headset.""  
>  
>""The standard-issue HoloLens, which costs $3,500, enables people to see holograms overlaid over their actual environments and interact using hand and voice gestures.""  
>  
>""A group of employees called on Microsoft to cancel the HoloLens contract. “We did not sign up to develop weapons, and we demand a say in how our work is used,” the employees wrote in an open letter regarding the HoloLens contract.""

Thoughts on this news? What do you guys think about some employees opposing the decision? All I know is Microsoft is a monster of a company. Just another reason to continue holding I guess.",['MSFT']
mhdrqg,gsylq0s,stocks,comment,1617226342,Visionmicro ftw,
mhdrqg,gsynth8,stocks,comment,1617227382,There's a different 'micro' stock that shot up ~40% because of this news,
mhdrqg,gsyhjt8,stocks,comment,1617224360,"On one recent bill gates interview he said his biggest regret is not to have a good relationship with washington, now MS really stepped up big time and being rewarded big time, they become one of the winner from this tax hike and actually gain more than they lose overall, same goes for microvison.",['MS']
mh71l1,,stocks,post,1617200130,"PSA: Blackberry / $BB is up 100% for the year, 30% YTD, Nokia ($NOK) is up 30% for the year. What the heck are people complaining about?Why are people always complaining how Blackberry is misunderstood? Why do they think their ""misunderstood"" technology isn't valued in? There's a chip shortage and $BB needs chips to make money. As far as I know, they don't actually manufacturer the chips. And other companies will get priority in chips before Blackberry.

Even with the recent dips, it's already up 100% for the year. That's pretty good for a stock that always misses out on revenue. And since they need chips to be successful during a chip shortage, I think this stock stays flat or even dips further for the year. But to finish 50-100% for the year is still a nice year. And I think their software is already valued in.

Even $NOK isn't too bad unless you bought at the year high. 

I just don't understand what people expect. Not every ticker can be *""you know what stock"".*

Disclosure: I'm a moron who has a $12/share cost basis, and just think I only have myself to blame. Shouldn't go chasing.",['PSA']
mh71l1,gsxbori,stocks,comment,1617205355,Lol if you think people bought at the beginning of the year,
mh71l1,gsxb46e,stocks,comment,1617205098,people bought 20s and up. some in the teens... there's the cause of the complaints.,
mh71l1,gsx3xai,stocks,comment,1617201760,Because people bought at its peak... And probably expected it to rocket to $100 or something outrageous in days/weeks.,
mh71l1,gsxk805,stocks,comment,1617209178,Lot's of people bough at $15+/share. FOMO can be a dangerous thing.,
mhhxq0,,stocks,post,1617231453,"BB BlackBerry earnings/call were actually bullish ✅I see **many** paper-handed individuals dumping their shares for cheap because OMG BB has missed its revenue expectations for Q4. *(for reference $8.50 -8.7% 31st March 2021)*

Can we please dig a little bit deeper? Thank you.

*During the quarter BlackBerry entered into an exclusive negotiation with a North American entity for the potential sale of part of the patent portfolio relating primarily to **mobile devices, messaging and wireless networking.** The Company has limited its patent monetization activities due to the ongoing negotiations. If the Company had not been in negotiations during the quarter, we believe that Licensing revenue would have been higher.*

**Boom** pure and simple explanation for why the revenue missed. It’s not on weaker demand. It’s only because they are about to sell their side business and consequently they had to significantly cut that stream of revenue. Which also means that negotiations are advanced.

**What will happen then they sell?** they will receive a big fat cheque (don’t quote me on this but I imagine north of $500m if not a billion+ ; pure speculation) + according to the CEO they will collect royalties for 7 years. And they get to focus on their core businesses: cybersecurity, EV software, internet of things.

Is this good strategy-wise? Absolutely. Focus on your top projects with higher gross margins. Let go of the past and embrace the future. 

**any analyst reaction? Yes indeed Canaccord upgraded the stock to Hold** from Sell this morning.

**Canaccord sees 'building blocks coming together'**

*Seeing the business ""turning the corner towards stronger trends”. The firm notes BB's weaker than expected Q4 results driven by licensing headwinds due to sales negotiations for part of its mobile patent portfolio.*

*Canaccord says BlackBerry management has ""created a cogent long-term strategy,"" but the firm is on the sidelines waiting for more evidence of product roadmap execution and emerging cross-selling opportunities.*

*The firm says a deal to sell the licensing business would ""unlock value and provide a capital infusion to drive accelerated software and services growth.""*

So even boomers traditionally late to the technology party are starting to see the whole BlackBerry’s strategy aligning. But these guys stay on the sideline because they don’t like early tendies. They lack the vision to say it’s an actual Buy especially at these levels. They will probably wait that a bigger broker moves first. And they will. 

**a quick look at the numbers** BlackBerry has a $5bn market cap with $1bn+ yearly revenue and $800m in cash. I imagine investors can put 2 and 2 together. What do you think will happen to their balance sheet when they cash in the incoming sale of their portfolio. Way more cash to execute their plans and potential M&A if needed and no need for new shares issuance as confirmed by the CEO (no dilution in sight ; enough money in the bank). We could be in the coming weeks in a situation where BB has in cash the equivalent of 25%+ of their market cap...

**how about their core strategy?** 
*QNX now has design wins with 23 of the world's top 25 electric vehicle OEMs and remains on course to return to a normal revenue run rate by mid-fiscal 2022. BlackBerry IVY also made encouraging progress, with positive engagement from a number of leading automakers and the launch of our BlackBerry IVY Innovation Fund.* 

In just one quarter they added 4 more EV OEMs with QNX (from 19 to 23 now). 

They are well positioned to be involved in autonomous driving: *BlackBerry expands its partnership with Baidu to power next generation autonomous driving technology.* and *BlackBerry QNX Black Channel Communications to be used in Motional's driverless platform.* These are weeks-old news but it’s funny how it seems to go under the radar when it comes to price the company. Correct me if I’m wrong but Baidu could be the first and/or major player in autonomous driving in Asia. 

QNX is still in SpaceX rockets. And I start to hear rumors that Tesla could consider using it too (very speculative but at least you’ve heard it).

And for the people who have ended up here randomly BlackBerry [IVY](https://blackberry.qnx.com/en/aws) is a joint venture with Amazon AWS for intelligent vehicle data platform. When the IVY deal was released BB shot past $9. AWS boss/founder at the time is now Amazon CEO. 

So yea the revenue has missed by a few millions for an one-off reason. Have the fundamentals changed? Actually yes they have improved as they are well on track to pursue their strategic goals.

The question you should ask yourself is whether you are pricing BlackBerry based on their FY2020 or on what they are about to become? (hint: strong presence in EV software worldwide + autonomous driving + efficient cybersecurity product)

Before you ask me in the comments: shares are safe, calls good luck timing them although I probably bought more June calls together with some shares (don’t do this at home ; go cash gang ; save your money). Disclosure: long shares and June 20C.

*Definitely not a recommendation to buy, hold, sell any security. Besides I have no knowledge in IoT, programming, software etc. I can only read.*

**TLDR** why are you selling BB? if that’s because the revenue has slightly missed because they are selling a big chunk of their unneeded business for big money then you should ask yourself why you are in this ship in the first place. Even boomers analysts upgraded the stock this morning: they are starting to see BlackBerry business model happening.

Bonus: when will the sale happen? 🔮 crystal ball said before the next ER so in a few weeks (totally random and speculative).","['BLL', 'TSLA', 'AMZN']"
mhhxq0,gszhl41,stocks,comment,1617243032,"So much negativity here. What's wrong with you people? OP presented a decent opinion with facts explaining why he thinks what he thinks. If you disagree, move on instead of replying with ""lol bagholders"", or provide a legitimate rebuttal.

Disclosure: I got in BB pre-peak but still higher than I'd like, but this was a play till end of 2022 before I reevaluated. Am I salty that my CB is high? Yes. Am I salty I got into BB in the first place? Absolutely not. I'm looking at this as a tech growth play and it can be risky, but it also has the ability to skyrocket within 3 years.",['CB']
mhhxq0,gsz31ql,stocks,comment,1617235378,I agree the market was just looking for a reason to take a shot at BB and lower it. Wouldn’t be surprised to see institutional ownership increase by next quarters reports.,
mhhxq0,gsyz4z7,stocks,comment,1617233284,pov: you're holding the bag,
mhhxq0,gsyzp4t,stocks,comment,1617233586,Upvoted for early April Fools joke.,
mhnavv,,stocks,post,1617250316,"Apple collaborating with TeslaApple will begin using Tesla’s batteries at their new solar farm. 

This may lead to a long lasting relationship regarding battery technology. Tesla is more than a car company. It is a mass data collection company, battery innovation company, and lastly a car manufacturer. 

https://www.theverge.com/2021/3/31/22360839/apple-tesla-megapack-energy-storage-grid-solar-batteries","['TSLA', 'AAPL']"
mhnavv,gt00ojk,stocks,comment,1617255217,They have to be kicking themselves for not acquiring Tesla when they literally were provided the opportunity.,['TSLA']
mhnavv,gszychd,stocks,comment,1617253413,This may be interesting knowing Apple's MO they HAATTEEE using other companies for parts. The fact they have to rely on Elon for batteries means only 2 possibilities: 1. Discontinue iCAR; They know the EV car competition is light years ahead only way to catch up is to use all their capital reserve which is an insane gamble  2. They're continuing with the iCAR project but have to resort to using Tesla's batteries,"['MO', 'TSLA', 'AAPL']"
mgzbrc,,stocks,post,1617169909,"Quick Reminder: Having a portfolio consisting of different tech stocks does not mean you have a ‘Diversified Portfolio’To whom it may concern: (I’m aware most of you know how to properly diversify). 

I see some investors on here being invested in multiple tech equities, APPL, TSLA, AMZN, SONO etc. and talking about how well diversified their portfolio is. 

Just a quick reminder than having a diversified portfolio means that you have equities with ‘negative correlation’, and/or no correlation in addition to being diversified into different asset classes (equities, fixed-income, cash)(ex. stocks, bonds, mutual funds, ETF’s). 

Or into different market caps, levels of risk, growth/value, sector/industries as well as domestic and foreign investments. 

Any political, economical, or social catalysts that can affect the tech industry will most likely affect all your investors at the same time, in the same way, therefore just a quick reminder that having a portfolio consisting of only techs does not reduce the overall risk in your portfolio, and if anything, increases it, as such, you are not ‘Diversified’.

This doesn’t just apply to techs, it applies to any portfolio that only has positively correlated assets within the same sector/industries.

Edit: This post is about the concept of having a diversified portfolio, not rate of return or investment objectives, capital limitations etc. Pls keep comments and topics relative to diversification.","['TSLA', 'AMZN']"
mgzbrc,gsx4g2y,stocks,comment,1617202011,"I'm very diversified.... I have AAPL, $TSLA, $AMZN, $MSFT, $HOUSE, $CAR, $SUV, $DEGREE, $SON, $WIFE, $VEGETABLEGARDEN

They are negatively corelated too... last year, when $AAPL, $TSLA, $AMZN, $MSFT ripped during the pandemic, $WIFE became very volatile acting like a penny stock and my $SON and $SUV crashed. $HOUSE appreciated but I need to pay tax on it even though I never sold.","['MSFT', 'TSLA', 'AMZN', 'AAPL']"
mgzbrc,gsw3tle,stocks,comment,1617174266,"So you mean if I buy both TSLA and NIO, I’m not fully diversified?!?",['TSLA']
mhhn8h,,stocks,post,1617230501,"Why is NASDAQ trade volume at 4% of daily avg. while Dow had a 10000% daily avg. volume today?**EDIT: Yahoo Finance seems to have their historical data calculated wrong, leaving the post up in case others are wondering why. And yes, I meant to say Dow Jones Industrial, not Dow. Data for Nasdaq is also wrong, seeing as they had a trade volume at 11:14 am alone, for 1.59 billion.**

[Dow](https://imgur.com/B6ksdUN) and [NASDAQ](https://imgur.com/9nPzyeH)

This seems like a historic anomaly, yet I can't find any articles or information as to why or how this would happen. 

I've heard some speculation that this might have to do with SLI(supplemental liquidity ratio) that did not get extended, but I don't understand the correlation. Some big players that want to deleverage and reduce their risk?

Someone else suggested it was related to quarterly reports, yet this trade volume anomaly has never occurred at any other end of quarter, or at all(as far as I could see), in the last 5 years at least.

Am I missing something? Does anyone have an explanation?","['NDAQ', 'DOW']"
mhhn8h,gsyw2qp,stocks,comment,1617231630,"I don't really understand how a 10,000% increase in volume moves the price almost zero. People buying their own shares with a seperate brokerage account obviously. Reminds me of the days you could bid up the price on your own ebay items without them catching you!",['EBAY']
mhhn8h,gsyu6r4,stocks,comment,1617230632,"I believe there was ETF rebalancing today at the end of trading hours. However, I could be wrong",
mhhn8h,gsywcri,stocks,comment,1617231781,The volume isn't correct there's another post about it,
mhgcil,,stocks,post,1617226510,"$PSFE (Paysafe) the most undervalued fintech play on the market. Popular analyst Steve Grasso has been calling for it to triple.Using the lower end of  Paysafe’s forecasted EBITDA ($500M), $1.5B revenue, an EV adjusted for  $1.8B debt, and applying the post-merger pro forma 720M outstanding  shares, here are Paysafe’s potential share prices based solely on sector  peer **EV/EBITDA ratios:**

⁃ PayPal : $269B EV/ $4.47B EBITDA

    	= 60.2x &amp;gt;&amp;gt;&amp;gt; Paysafe $28.2B EV / SP: $39.28   

⁃ Repay : $2.2B EV/ $30M EBITDA

    	 = 73.3x &amp;gt;&amp;gt;&amp;gt; Paysafe $34.8B EV / SP: $48.43   

⁃ Shift 4 : $7.7B EV/ $90M EBITDA

    	= 85x &amp;gt;&amp;gt;&amp;gt; Paysafe $41B EV / SP: $56.91   

⁃ Nuvei : $15B EV/ $171M EBITDA

    	= 87.7x &amp;gt;&amp;gt;&amp;gt; Paysafe $42B EV / SP: $58.40   

⁃ Adyen : $56B EV/ $273M EBITDA

    	= 205x &amp;gt;&amp;gt;&amp;gt; Paysafe $101B EV / SP: $139   

⁃ Square : $107B EV/ $357M EBITDA

    	= 299.7x &amp;gt;&amp;gt;&amp;gt; Paysafe $148B EV / SP: $205.64   

⁃ [Bill.com](https://bill.com/) : $13.2B EV/ -$15.6M EBITDA

    	= 308x &amp;gt;&amp;gt;&amp;gt; Paysafe $152B EV / SP: $211.39   

⁃ Affirm: $21.6B EV/ -$68M EBITDA

    	= 317x &amp;gt;&amp;gt;&amp;gt; Paysafe $156.7B EV /SP: $217.64   

EV/Revenue ratio , non-public company’s with estimated revenue per recent funding rounds:

⁃ Stripe : $95B EV/ $1.8B est. rev

    	= 52.8x &amp;gt;&amp;gt;&amp;gt; Paysafe $77.3B EV / SP: $107.44   

⁃ Chime : $30B EV/ $600M est. rev

    	= 50x &amp;gt;&amp;gt;&amp;gt; Paysafe $73.2B EV /SP: $101.67   

⁃ Checkout : $15B EV/ $100M est. rev

    	= 150x &amp;gt;&amp;gt;&amp;gt; Paysafe $223.2B EV / SP: $310   

Note: Most of these companies have negative earnings and smaller margins than Paysafe.

I’m  not suggesting it’s worth this much, but for reference, averaging the  above multiples would put BFT/Paysafe’s share price at $135.98

More realistically, taking the average from the lowest four puts the share price at $50.75.

Paysafe is the number 1 digital wallet in Igaming, Draftkings uses them, and most recently they just partnered with Coinbase. As all SPACs do now, it sold off big today with the ticker change so there has never been a better time to buy than now! 

Note : I’m long PSFE with 3,350 shares @15.47

Credit all the numbers to u/greensymbiote","['PYPL', 'AMP']"
mhgcil,gsyneze,stocks,comment,1617227184,"I like this stock also. Building a position as opposed to taking an outright huge positions given where the overall market is. Good analysis. Just remember there is more than numbers. Partnerships, Mgmt, business sectors, etc. it’s not all apples to apples",
mhgcil,gsz2sqb,stocks,comment,1617235248,This better get me a Big house in front of Pacific Water in British Columbia.,
mhgcil,gsz7ucs,stocks,comment,1617237917,And they're down today??? I'm buying more tmr if its down more.,
mhgcil,gsyv49f,stocks,comment,1617231122,"I like your thinking although paysafe's margins are lower and the margin for growth is also lower. But even with that taken into account and with a greater possible TAM ( so more growth as projected hopefully ), and revenue projection outperformances. I have a pt of 25-30 for this stock by the end of **2022 (** with an outperformance target of 40 dollars if the sports betting legalisation is accelerated across the  US )",
