post_id,comment_id,subreddit,text_type,epoch_time,text,tickers
mhi9gc,,StockMarket,post,1617232496,"ARK Innovation’s Thematic Approach is Not well prepared for a Major Twist**Not popular topics for those who expect the high tech momentum will dominate the most gains in stock market forever.** ***It is time to review one's portfolio to adjust and factor into risk translate to a resonable reward even when the market chills.*** 

Personnel issues and lax risk controls loom large here.

[**Robby Greengold, CFA**](https://www.morningstar.com/authors/2146/robby-greengold)Mar 31, 2021

 [ARK Innovation ETF (ARKK)](https://www.morningstar.com/etfs/arcx/arkk/quote), [American Beacon ARK Transfmt Innov A (ADNAX)](https://www.morningstar.com/funds/xnas/adnax/quote)

Thematic-investing specialist ARK Investment Management has been in tune with the market’s unfolding narrative in recent years, but its lone portfolio manager, inexperienced team, and lax risk controls make it ill-prepared to grapple with a major plot twist. Its flagship strategy, ARK Innovation ([ARKK](https://www.morningstar.com/etfs/arcx/arkk/quote)), earns a Morningstar Analyst Rating of Neutral.

## The Pitch and the Niche

ARK believes that equity indexes are full of value traps in danger of technological obsolescence and that traditional asset managers hew too closely to their benchmarks, thereby loading themselves up with stocks in [doomed industries](https://research.ark-invest.com/hubfs/1_Download_Files_ARK-Invest/White_Papers/ArkInvest_101420_Whitepaper_BadIdeas2020.pdf). Its solution is to invest across five technology platforms--artificial intelligence, blockchain, DNA sequencing, energy storage, and robotics--that it thinks will revolutionize how economic sectors across the globe operate.

True to form, the firm’s products look unlike any index. The portfolio of its flagship strategy, ARK Innovation, is top-heavy, makes huge industry bets, and has historically invested in publicly traded companies of virtually every size. It embraces money-losing companies so long as they’re aggressively investing to exceed their already high growth expectations.

The firm defines success differently from most long-only funds. Rather than aim to outperform an index, the firm cares most about achieving high returns and invests only in companies it thinks will gain 15% or more annualized over the next five years. That hurdle is roughly double the annualized return of the Russell Mid Cap Growth Index (the fund’s category benchmark) since 2000.

The firm’s etf lineup has done far better than that. Its flagship strategy, which combines ideas expressed in its six other actively managed ETFs, gained 150% in 2020. A flood of inflows followed. Over the 12 months through February 2021, the firm’s total assets under management leapt to roughly $80 billion from less than $12 billion.

The firm is shareholder-friendly in some ways. It has developed its product lineup thoughtfully by maintaining its focus on the handful of innovation platforms and underlying technologies it thinks have longevity. Its ETFs are cost-competitive relative to actively managed rivals.

But few features of its research team or process suggest ARK Innovation will continue to beat the Russell Mid Cap Growth Index on a risk-adjusted basis.

## The Key Person

ARK’s main draw is its founder, chief executive officer, and portfolio manager Cathie Wood, who, after more than three decades in the industry, launched the firm in 2014.

## MORE ON THIS TOPIC

* [**No Room on the ARK?**](https://www.morningstar.com/articles/1027682/no-room-on-the-ark)

She honed her thematic-oriented process at AllianceBernstein from 2001 to 2013, where she ran several strategies similar to this one that had high volatility, poor downside performance, and underwhelming long-term results during her tenure. During her 12 years at the helm of large-growth separate account AB MA Strategic Research, its before-fee total returns comfortably outpaced the Russell 1000 Growth Index *but lagged on a risk-adjusted basis*. She also managed two growth-oriented mutual funds--one focused on domestic mid-caps, the other on global stocks--whose net-of-fee results underperformed their bogies on her watch, risk-adjusted or otherwise.

And yet, as ARK’s primary investment decision-maker who has established a ubiquitous media presence and enthusiastic following, Wood is essential to the firm’s continued success. Director of research Brett Winton would likely succeed her if needed, but his nearly 15 years of industry experience include none as a portfolio manager. Exacerbating that key-person risk is the firm’s inability to develop and retain talent: Many of the analysts supporting the funds’ research have come and gone, and most of the remaining nine lack deep industry experience.

## Not Your Typical Analyst Team

The firm’s analyst bench is [distinct](https://ark-invest.com/the-ark-difference/) from traditional asset managers, but not in a good way. The typical equity research analyst in the asset management industry has a predictable set of credentials: an undergraduate degree from a name-brand institution, some entry-level work experience, an MBA, an analytical internship, and at least some progress toward investment-related credentials, such as becoming a CFA charterholder. Almost none of ARK's analysts have progress beyond earning bachelor's degrees.

Indeed, ARK’s research-related job postings [tend not](https://research.ark-invest.com/hubfs/1_Download_Files_ARK-Invest/Job_Positions/Job_Opportunity_Analyst-Fintech.pdf) to demand credentials of any kind. That sort of openness expands the applicant pool and invites individuals of various backgrounds and experiences to submit their resumes. The firm may be on to something there. Cognitively diverse teams can be more creative or innovative than those without a variety of perspectives. (1)

Investing Insights

Top investment picks and tips anytime, anywhere

[Listen Now](https://msmedia.morningstar.com/mstar/adclick/FCID=129694/site=ms.us/pgid=Kessler/area=Articles/topic=EXCHANGETRADEDFUNDS/collection=2/authorId=2146/subtopic1=VOLATILITY/random=27992636/viewid=27657263/usrt=v/size=dynamicoffer/pos=offer1/pgid=articleoffer/relocate=https://www.morningstar.com/podcasts/investing-insights)

But this team’s collective experience seems significantly more limited than that of other firms. Only about half the current team came to ARK with a history of full-time work.

## Crowdsourcing

ARK outsources much of the technical expertise to “[theme developers](https://research.ark-invest.com/hubfs/1_Download_Files_ARK-Invest/Marketing_Material/ARK-Invest-Thematic-Investment-Process.pdf)”--some of whom the firm says are academics, entrepreneurs, and former ARK analysts--who donate their time. It also invites feedback on its research and new investment ideas from individuals following the firm through social media. These features make the firm’s process of gathering and digesting information unique, but its analytical edge remains unclear in an industry that provides (for a fee) subject-matter experts to advise shops that lack requisite technical know-how.

## A Peculiar Analyst Coverage Model

Wood [thinks](https://youtu.be/-hnK2cEvbJg?t=350) other asset managers set up their analyst teams poorly to comprehend the potential impact of these technologies on the economy. Rather than assigning analysts coverage of economic sectors--a common industry practice that Wood thinks creates information silos--ARK assigns them one or more technological specialties. For example, [one](https://ark-invest.com/our-team/) analyst covers energy storage, robotics, and reusable rockets; another covers automation, robotics, energy storage, alternate energy, and space exploration.

Wood has a point. Technology is crucial to both its purveyors and consumers and influences the sales and expenses of companies across all industries. It follows that analysts who can accurately forecast the accessibility, cost declines, and adoption rates of the most promising innovations could have a stock-picking advantage. But her views on this don’t radically diverge from her competitors. Many recognize the downsides of industry specialization and try to mitigate them by fostering collaboration across sectors or implementing a generalist approach.

In some ways, ARK’s setup could lead to ultra-specialization and potential blind spots that better resourced firms wouldn’t miss. For example, it assigns DNA sequencing, genome editing, and immunotherapy to two analysts who are early in their careers and at a disadvantage to their healthcare-focused rivals. The teams of other shops collaborate to cover biotech, pharma, and life-sciences firms in breadth and depth and staff their teams with seasoned analysts holding doctorates or other advanced degrees in medicine, biology, or neuroscience.

## Unrestrained, Unaware, and Unconcerned

ARK Innovation’s benchmark agnosticism and high return targets saddle the portfolio with risks that Wood manages mainly with instinct rather than data or rules. The firm, which has no risk management personnel, views the subject almost exclusively through the lens of its scoring system that monitors six inputs to a stock’s investment thesis. They are:

1) Company, People, and Culture  
2) Execution  
3) Moats: Barriers to Entry  
4) Product Leadership  
5) Valuation  
6) Thesis Risk

These form the basis of levelheaded bottom-up research--most investment teams use some variation of them--but they provide little visibility into the portfolio’s aggregate risk exposures.

Wood assembles the portfolio one stock at a time, using each stock’s cumulative scores as a guide to position sizing. But these scores say nothing of each stock’s sources of risk and return, which may be highly and undesirably correlated to one another. There [is potential](https://research.ark-invest.com/hubfs/1_Download_Files_ARK-Invest/White_Papers/ARKInvest_052720_whitepaper_Innovation-Allocation.pdf) for diversification across innovation platforms--but the firm’s self-categorization of its investable universe does not by itself imply a rigorous understanding of which stocks are likely to rise, fall, succeed, and fail together. Forward-looking estimates of the holdings’ correlations and variances or other input from a separate risk-management team, on the other hand, would do more. (2)

Such analysis is complex and nonessential for most of this strategy’s rivals. That’s because the typical long-only equity strategy defines its risk limit and stays within it, for example, by anchoring its sector weights to prevent extreme sector concentration. ARK has few portfolio construction parameters. It has said it will generally invest no more than around 10% of ARK Innovation’s assets in a single company (it has adhered to this guidance) and no more than half of ARK Innovation’s assets in a single technology.

To be sure, ARK makes no promise to diversify its portfolios, and it [tells investors](https://youtu.be/Qb8uQSQi8bc?t=396) to expect volatility. But even a high-octane strategy like this one should be cognizant of the risks embedded in its portfolio and manage to a definable risk tolerance. It seems not to. Indeed, on March 29, 2021, the fund removed prospectus language limiting the size of its top positions and its ownership percentage of individual companies’ shares outstanding.

## Blind to the Future

The portfolio has become less liquid and more vulnerable to severe losses as its size has swelled. In the 12 months ended February 2021, the ETF’s assets under management grew more than tenfold to over $23 billion. It has retained and grown its stakes in small companies that are now much more difficult to sell without [materially impacting](https://www.morningstar.com/articles/1027682) their stock prices. Across all U.S.-domiciled funds, the ETF stood out in February for having the most concentration in companies in which it owned 10% or more of floating shares--that doesn’t even include additional vehicles tied to the strategy, which combined amount to another $15 billion.

The firm has [minimized](https://ark-funds.com/innovation-webinar-series/capacity-and-liquidity-analysis) the notion that the ETF’s *downside has become steeper*, mostly by relying on the past as a guide to the future. But its heft is new, and future market crises will be different from previous ones. Without risk-management professionals to stress-test the portfolio’s risk exposures, estimate its potential losses during historical or hypothetical market environments, and gauge worst-case scenarios, the team is poorly positioned to prepare and react.

But even with such a team, there’s no sign that Wood would heed its advice. A central tenet of her process is to amplify exposure to the fund’s riskiest holdings when market uncertainty is highest. In a market crisis, her game plan is to sell first the fund’s “cashlike” stocks--those that possess the most diversified sources of revenue, are typically large cap, and are the most liquid--to favor as few as 32 “pure plays” that are often unprofitable small caps that are less liquid and extremely volatile.

She followed a much milder version of this playbook at AllianceBernstein’s Strategic Research strategy during the market’s 2008 implosion. There, she consolidated the portfolio to 47 or so stocks and kept it focused on liquid large caps. It did not have anywhere near the level of ownership in individual companies as ARK Innovation has today. In 2008, that large-growth-oriented separate account lost 45% before fees--substantially worse than the Russell 1000 Growth Index’s 38% decline.

Other potential consequences of the strategy's size are less dire but hinder its ability to exploit good ideas and oust bad ones. Nimble execution is now tougher than before. To mitigate market-impact costs, ARK must build new positions more slowly and exit gradually. But its bullish or bearish signals are available for all to see--as an ETF, the strategy must disclose its portfolios to the market each day--and traders can respond either by buying up a stock’s known supply (putting upward pressure on its price) or selling it (downward pressure) before ARK has offloaded its own position. (2)

## Reasonable Doubts

ARK’s pursuit of disruptive innovators has merit, and its quest for big rewards may appeal to aggressive investors who can stomach the risk of potentially heavy losses. But ARK’s team of inexperienced analysts, go-with-your-gut risk management approach, and bloated asset base raise doubts about whether this fund’s outstanding historical results can continue.

## Works Cited

*1. Woolley, A.W., Aggarwal, I.; & Malone, T.W. 2015. ""Collective Intelligence and Group Performance.""* Current Directions in Psychological Science, *Vol. 24, No. 6, P. 420. DOI: 10.1177/0963721415599543.*

*2. Lussier, J., & Reinganum, M. 2018. Active Equity Investing: Portfolio Construction. CFA Institute.*","['ARKK', 'MS']"
mhi9gc,gsyxokc,StockMarket,comment,1617232496,"Hello! It looks like you might have submitted a post about getting started, looking for book/YouTube/podcast recommendations, or another commonly asked question on /r/StockMarket. To help new investors and traders with these questions, we created a comprehensive [market toolkit](https://github.com/ckz8780/market-toolkit) which has lots of resources for new and experienced traders alike. Here are some direct links in it that you might find useful:

- [Getting Started](https://github.com/ckz8780/market-toolkit#getting-started)
- [Books](https://github.com/ckz8780/market-toolkit#books)
- [YouTube Channels, Talks and Speeches](https://github.com/ckz8780/market-toolkit#youtube)

The phrase or keyword that triggered this response was ""**podcasts**"". Here's [a customized link that will search the whole subreddit](https://www.reddit.com/r/StockMarket/search?q=podcasts&restrict_sr=on&sort=relevance&t=all) for the same topic.


*I am a bot, and this action was performed automatically. Please [contact the moderators of this subreddit](/message/compose/?to=/r/StockMarket) if you have any questions or concerns.*",
mhi9gc,gsz07fj,StockMarket,comment,1617233857,"History has been pretty unkind to last year's phenom in any market.   And I am afraid that may be where she is headed.   Hopefully she is not one and done, as I believe her themes will have big winners.  The problem is AMZN, CSCO, MSFT and others were in the tech theme in the late 90's and obviously are very big winners but they suffered 10 years or more (CSCO is still not back to spring 2000 values) of huge losses to get to the point their value was actually realized in the stock price.","['CSCO', 'AMZN', 'MSFT']"
mhi9gc,gsz1jqb,StockMarket,comment,1617234575,"I have ***reduced*** my positions and still keep some of her etfs.  Those who recalled that I mentioned her stellar performance etfs did not really go through a stress test during a downturn like other fund managers now have second thoughts.

The funds I can not make out is 3D printing, space K fund and a Middle East country tech stocks.

Another one I am trying to reduce my positions is ***SPAC stocks***. Investors now realize these are just medium size companies trying to pretend to be big cap companies with little earnings.  A concept that sounds plausible not completely proven is a R&D start up getting funding through venture capitalists.",
mhi9gc,gsz22mw,StockMarket,comment,1617234856,I think that on WSB discord the smaller one not the main one you know the backup one. The voice chat died when cathie woods investing was called a shill for wokes. I think tucker carlson said it best last night with go woke go broke.,
mg7lqc,,StockMarket,post,1617077527,Found this in a book I’m reading... sounded familiar to a certain broker * cough * Robinhood.,
mg7lqc,gsrmnol,StockMarket,comment,1617077600,"What book is this?

I'd like to take a gander? ISBN if possible =)",
mg7lqc,gsrq9xo,StockMarket,comment,1617080238,I’m not an expert but most brokers take the other side of retail trades don’t they? As the numbers state that the probability is in their favour over a large enough sample size.. kind of like a casino.,
mh4ojz,,StockMarket,post,1617192439,"My opinion for WSFT opposite to LinkedIn perspective**WSFT** position self as stock against Microsoft and LinkedIn as largest SAAS platforms for Human Resources of Professionals for International Businesses.

Wikisoft’s flagship online platform, **Wikiprofile.com**, aims to be a powerful solution with tools and resources for businesses and business professionals to find valid information quickly and easily so that they can make informed career and hiring decisions.

By leveraging artificial intelligence and machine learning techniques, Wikisoft seeks to process raw data elements and refine them into tangible and valuable insights for businesses and business professionals.

They believe, In line with increasing globalization, that there is a growing demand for access to credible company and employee information worldwide.  
Despite the fact that Wikisoft's (**WSFT:US**) business directory system capitalizes on the freemium subscription-based version to use a service that far goes beyond the offerings provided by competitors such as LinkedIn and also Glassdoor.

Let´s compare Wikisoft, which is a relatively new company, with its peers and what they have accomplished:

Hired raised **132$ million** since founding in 2012. More than 10,000 of the top companies using Hired and can save significant time screening their candidates. In fact it is claimed that it **reduces the time to hire by 33%!**

Glassdoor, founded in 2008 was acquired by Recruit Holdings for **1.2$ billion** in May 2018. Provides recruiting solutions to over 7,000 employers – including 40% of the Fortune 500 companies.

Last but not least, LinkedIn (established in 2005) was acquired by Microsoft for a staggering **26.2$ billion**. It is estimated that their channel sales consist of 3.4$ billion Talent solutions, 1$ billion Marketing solutions and 1.3$ billion subscriptions.

With companies in their growth phase, it is important to gather a lot of cash. This can be best done with dilution of shares. Wikisoft has filed a listing on the OTC stock exchange exactly for this reason.

In order to invest more in their growing company and reaching their goals they need a lot of cash.",['MSFT']
mgwn4n,,StockMarket,post,1617159559,"TILRAY (TLRY) NEW YORK APPROVES MARIJUANA BILL FOR RECREATIONAL USEJonathan M Block (SA News)
The New York State Senate Tuesday evening approved a bill that would legalize marijuana for recreational use by a vote of 40-23.
The bill, the Marijuana and Taxation Act, is expected to easily pass the State Assembly.
Although Gov. Andrew Cuomo (Dem.) has said he will sign the legislation and cannabis legalization would then become legal immediately, marijuana sales in stores would take 18 months to two years to start, according to State Assembly Majority Leader Crystal Peoples-Stokes.
Cuomo's office has said that once fully implemented, marijuana legalization is expected to rake in $350M annually in tax revenue.
U.S. multi-state operators today: Curaleaf Holdings (OTCPK:CURLF) -3.6%; MedMen Enterprises (OTCQB:MMNFF) -0.6%; Acreage Holdings (OTCQX:ACRHF) -0.1%; Harvest Health & Recreation (OTCQX:HRVSF) +0.8%; Cresco Labs (OTCQX:CRLBF) -5.2%; Green Thumb Industries (OTCQX:GTBIF) -11.8%; Trulieve Cannabis (OTCQX:TCNNF) -5.9%.
Canadian cannabis players today: Aurora Cannabis (NYSE:ACB) unchanged; Canopy Growth (NYSE:CGC) +1.7%; Aphria (NASDAQ:APHA) +3.9%; Cronos (NASDAQ:CRON) +1.5%; Tilray (NASDAQ:TLRY) +1.9%; OrganiGram Holdings (NASDAQ:OGI) +3%; HEXO Corp. (NYSE:HEXO) +1.9%; Sundial Growers (NASDAQ:SNDL) +1.8%.",['NDAQ']
mgwn4n,gsvkh7m,StockMarket,comment,1617160587,How does TLRY factor into states decisions’ to legalize since it’s a Canadian company?,
mgwn4n,gsvku1f,StockMarket,comment,1617160802,It’s going to take two years before the program for selling is fully operational. As a side note individuals cannot grow their own until 18 months after the first dispensary opens.,
mgv5d9,,StockMarket,post,1617154486,[Part 1/2] The Story of The GameStop Short Squeeze By Financial Times 20 Mins and 44 Seconds (Quite Good! Enjoy!!!),
mgv5d9,gsvfflc,StockMarket,comment,1617157645,....but the squeeze hasn't even been squozed,
mgv5d9,gsxl8qp,StockMarket,comment,1617209635,"Funny.  The one old hag doesn't even know that Nokia doesn't sell cell phones anymore. They are a telecommunications equipment business.  Nokia the cell phone is licensed to HMD Global.  [https://finance.yahoo.com/quote/NOK/profile?p=NOK](https://finance.yahoo.com/quote/NOK/profile?p=NOK)

[https://en.wikipedia.org/wiki/HMD\_Global](https://en.wikipedia.org/wiki/HMD_Global)

These people talk with confidence and they know shit.  Saying GME will go down eventually?  They don't know that for sure.  Cohen and team can make GME the Amazon of gaming.",['AMZN']
mgv5d9,gsvb1m0,StockMarket,comment,1617155220,Somehow WSB banned this. Not sure why?!?! Let’s make them jealous!!!🙌🙌🙌💎💎💎,
mhbfns,,StockMarket,post,1617212532,Discovery's Class B shares spike 80% in unusual move,
mhbfns,gsxtsm9,StockMarket,comment,1617213476,Oh wow.  Wonder why GSX and VIAC didn't follow suit?,['VIAC']
mhn5r0,,StockMarket,post,1617249785,"BabywallstreetBets • r/BabywallstreetBets .... join the cause, Save an ape 🦍!! 🚀🚀🚀",
mhn5r0,gszyxov,StockMarket,comment,1617253857,r/potstreetbets while youre at it,
mgyft3,,StockMarket,post,1617166220,"Cannabis industry still trading side ways. Good buy?Federal legalization in Mexico and Rec. Use legalized in NYS (along with many other states voting soon), has me thinking the cannabis industry is undervalued. Moreover, As many in the political world know, U.S. legal policy sets international standards on some level. Which would make me think that in the next year or two other countries will follow suit. 

Overall think it’s a great buy for a long term strategy. (Literally anything over a year)

Personally, I’m looking at ETFs like $MJ and $THCX. There aren’t many others but I would be interested in some that may focus more on the international markets. 

Lmk what you think. 

Cheers",
mgyft3,gsvufrx,StockMarket,comment,1617167314,"Didn’t even know these existed until just now so thank you as well. Was down on tilray by like 40 and thought I was a bag holder and dumped it, was wondering what to do with that money in weed stocks and I think I found my answer lol",
mgyft3,gswt9if,StockMarket,comment,1617196256,I'm buying CRON. Why? Technicals. MACD & STOCHASTICS turning positive.  Those are the two indicators I follow. I'm sure there are other plays but I've made money on CRON...bought @ 3.50 & sold @ 10 a while ago. I'm jumping back in. Stick to what I know. GL all!,['GL']
mgyft3,gsx0g1z,StockMarket,comment,1617200081,I love the marijuana ETFs. I’ve never been red in $MJ or $THCX since buying into them once I knew dems were gonna be in charge of things. Easy hold for me the next couple years,
mgyft3,gsw14c7,StockMarket,comment,1617172360,https://www.reddit.com/r/wallstreetbets/comments/mgumhs/tlry_to_the_moon_420_cannabis_stock_market_rally/?utm_source=share&utm_medium=ios_app&utm_name=iossmf,
